"List of International Organisations for which a simplified reporting of AnaCredit counterparty reference data applies, unless otherwise decided by the relevant NCB",,,,,
"Source landing page: https://www.ecb.europa.eu/stats/ecb_statistics/anacredit/html/index.en.html",,,,,
"Source file: https://www.ecb.europa.eu/stats/money/aggregates/anacredit/shared/pdf/List_of_international_organisations.xlsx",,,,,
"Reuse policy: https://www.ecb.europa.eu/stats/ecb_statistics/governance_and_quality_framework/html/usage_policy.en.html",,,,,
#,International organisation,Head office / Location,Comment,Counterparty identifier (unless otherwise decided by the NCB),International Organisation Code
1,Agency for the Cooperation of Energy Regulators [ACER],Ljubljana,Regulation (EC) No 713/2009,E$0ECBM00023,4J81
2,Body of European Regulators for Electronic Communications [BEREC],Riga,Regulation (EC) No 1211/2009,E$0ECBM00049,4J82
3,Committee of Regions  [CR],Brussels,Maastricht Treaty 1993,E$0ECBM00056,4J7
4,Community Plant Variety Office [CPVO],Angers,Council Regulation (EC) No 2100/94 of 27 July 1994 on Community plant variety rights (OJ L 227 of 01.09.94 p.1).,E$0ECBM00064,4J83
5,Council of the European Union  [CEU],Brussels,Maastricht Treaty 1993,E$0ECBM00106,4J2
6,Court of Justice of the European Union [CJEU],Luxembourg,Treaty of Lisbon 2009,E$0ECBM00114,4J3
7,Economic and Social Committee  [ESC],Brussels,Treaty of Rome of 1957,E$0ECBM00122,4J6
8,European Agency for Safety and Health at Work [EU-OSHA],Bilbao,Council Regulation (EC) No 2062/94,E$0ECBM00148,4J85
9,European Agency for the Management of Operational Cooperation at the External Borders [FRONTEX],Warsaw,Council Regulation (EU) 2016/1624,E$0ECBM00155,4J86
10,"European Agency for the operational management of large-scale IT systems in the area of freedom, security and justice  [EU-LISA]",Tallinn,Regulation (EU) No 1077/2011,E$0ECBM00163,4J87
11,European Asylum Support Office [EASO],Valletta,REGULATION (EU) No 439/2010,E$0ECBM00171,4J88
12,European Atomic Energy Community [Euratom],Brussels,,E$0ECBM00189,4U
13,European Aviation Safety Agency [EASA],Cologne,Regulation (EC) No 216/2008,E$0ECBM00197,4J89
14,European Banking Authority [EBA],London,Regulation (EU) No 1093/2010,E$0ECBM00213,4T1
15,European Central Bank [ECB],Frankfurt,Treaty of Amsterdam in 1998,E$0ECBM00221,4F
16,European Centre for Disease Prevention and Control [ECDC],Solna,Regulation (EC) No 851/2004 of the European Parliament and of the Council of 21 april 2004,E$0ECBM00239,4J810
17,European Centre for the Development of Vocational Training [CEDEFOP],Thessaloniki ,Regulation (EEC) No 337/75,E$0ECBM00254,4J811
18,European Chemicals Agency [ECHA],Helsinki,Regulation (EC) No 1907/2006,E$0ECBM00262,4J812
19,European Commission [EC],Brussels,Treaty of Lisbon 2007/09,E$0ECBM00270,4D
20,European Community of Steel and Coal [ECSC],Luxembourg,Treaty of Paris 1951/1952,E$0ECBM00288,4H
21,European Council  [Council],Brussels,Treaty of Lisbon 2007/09,E$0ECBM00296,4J5
22,European Court of Auditors [ECA],Luxembourg,,E$0ECBM00304,4J4
23,European Data Protection Supervisor [EDPS],Brussels,,E$0ECBM00312,4J813
24,European Defence Agency [EDA],Ixelles,,E$0ECBM00320,4J814
25,European Development Fund [EDF],Brussels,,E$0ECBM00338,4E
26,European Environment Agency [EEA],Copenhagen,,E$0ECBM00346,4J815
27,European External Action Service [EEAS],Brussels,,E$0ECBM00353,4J816
28,European Fisheries Control Agency [EFCA],Vigo,,E$0ECBM00379,4J817
29,European Food Safety Authority [EFSA],Parma,,E$0ECBM00387,4J818
30,European Foundation for the Improvement of Living and Working Conditions [EUROFOUND],Dublin,,E$0ECBM00395,4J819
31,European GNSS Agency [GSA],Prague,,E$0ECBM00403,4J820
32,European Institute for Gender Equality [EIGE],Vilnius,,E$0ECBM00411,4J821
33,European Institute of Innovation and Technology [EIT],Budapest,,E$0ECBM00429,4J822
34,European Insurance and Occupational Pensions Authority [EIOPA],Frankfurt,,E$0ECBM00437,4T3
35,European Investment Bank [EIB],Luxembourg,,E$0ECBM00445,4C
36,European Investment Fund [EIF],Luxembourg,,E$0ECBM00452,4G
37,European Maritime Safety Agency [EMSA],Lisbon,,E$0ECBM00460,4J823
38,European Medicines Agency [EMA],London,,E$0ECBM00478,4J824
39,European Monitoring Centre for Drugs and Drug Addiction [EMCDDA],Lisbon,,E$0ECBM00494,4J825
40,European Network and Information Security Agency [ENISA],Heraklion,,E$0ECBM00502,4J826
41,European Ombudsman [Ombudsman],Strasbourg,Established by the Maastricht Treaty,E$0ECBM00510,4J827
42,European Parliament  [EP],Brussels/Strasbourg,,E$0ECBM00544,4J1
43,European Personnel Selection Office [EPSO],Brussels,Decision 2002/620/EC,E$0ECBM00569,4J828
44,European Police College [CEPOL],Budapest,Council Decision 2005/681/JHA,E$0ECBM00577,4J829
45,European Police Office [EUROPOL],The Hague,Regulation (EU) 2016/794,E$0ECBM00585,4J830
46,European Railway Agency [ERA],Valenciennes,4th EU Railway Package on 15th June 2016,E$0ECBM00593,4J832
47,European School of Administration [EUSA],Brussels,The European School of Administration was set up on 10 February 2005. Its task is to provide training in specific areas for members of EU staff.,E$0ECBM00601,4J833
48,European Securities and Markets Authority [ESMA],Paris,Regulation (EU) No 1095/2010,E$0ECBM00619,4T2
49,European Stability Mechanism [ESM],Luxembourg,Treaty Establishing the European Stability Mechanism,E$0ECBM00643,4S
50,European Training Foundation [ETF],Turin,Council Regulation (EC) No 1339/2008,E$0ECBM00650,4J834
51,European Union Agency for Fundamental Rights [FRA],Vienna,Council Regulation (EC) No 168/2007 of 15 February 2007,E$0ECBM00668,4J835
52,European Union Institute for Security Studies [EUISS],Paris,Council Joint Action of 20 July 2001,E$0ECBM00676,4J836
53,European Union Intellectual Property Office [EUIPO],Alicante,Council Regulation (EC) No 40/94,E$0ECBM00684,4J837
54,European Union Satellite Centre [SATCEN],Madrid,Western European Union Satellite Centre was incorporated as an EU agency on 1 January 2002.,E$0ECBM00692,4J838
55,Joint Committee of the European Supervisory Authorities ,London,Regulation (EU) No 1092/2010,E$0ECBM00890,4T
56,Nordic Development Fund [NDF],Helsinki,"A joint multilateral development finance institution of Denmark, Finland, Iceland, Norway and Sweden.",E$0ECBM00916,5Z43
57,Publications Office of the European Union [POEU],Luxembourg,"Decision 2009/496/EC,Euratom",E$0ECBM00981,4J839
58,Single Resolution Board [SRB],Brussels,Regulation (EU) No 806/2014,E$0ECBM00999,4M
59,The European Union's Judicial Cooperation Unit [EUROJUST],The Hague,Council Decision 2002/187/JHA,E$0ECBM01005,4J840
60,Translation Centre for the Bodies of the European Union [CdT],Luxembourg,Council Regulation (EC) No 2965/94,E$0ECBM01013,4J841
61,European Public Prosecutor's Office (in preparation) [EPPO],,"Established by TFEU Article 86, which allows for a simplified enhanced cooperation procedure which does not require authorization from the Council to proceed.",E$0ECBM01047,4J831
62,European Union [EU],BRUSSELS,,E$0ECBM01054,
63,European Financial Stability Facility [EFSF],Luxembourg,,E$0ECBM901678,4W
64,European Telecommunications Satellite Organization [EUTELSAT],Paris,"IDC,G3",E$ECBM8467139,6H
65,ATHENA Mechanism,Brussels,,E$ECBM922989,4J842
66,Africa Finance Corporation [AFC],Lagos,,N$0ECBM00024,5Z1
67,African Development Bank [AfDB],Abidjan,,N$0ECBM00032,5D
68,African Development Bank Group [AfDB],Abidjan,,N$0ECBM00040,5Z2
69,African Development Fund [AfDF],Abidjan,,N$0ECBM00057,5Q
70,African Export-Import Bank [Afreximbank],Cairo,,N$0ECBM00065,7H
71,African Union  [AU],Addis Ababa ,,N$0ECBM00073,6A1
72,Andean Development Corporation [ADC],Caracas,,N$0ECBM00081,5U
73,Arab Bank for Economic Development in Africa [BADEA],Khartoum,,N$0ECBM00099,5N
74,Arab Fund for Economic and Social Development [AFESD],Kuwait,,N$0ECBM00107,5Z3
75,Arab Monetary Fund [AMF],Abu Dhabi,,N$0ECBM00115,5M
76,Asian Clearing Union [ACU],Tehran,,N$0ECBM00123,5Z4
77,Asian Development Bank [ADB],Manila,,N$0ECBM00131,5E
78,Asian Development Fund  [AsDF],Manila,,N$0ECBM00149,5R
79,Association of Southeast Asian Nations  [ASEAN],Jakarta,,N$0ECBM00156,6A2
80,Bank for International Settlements [BIS],Basel,,N$0ECBM00164,5B
81,Banque des Etats de l'Afrique Centrale [BEAC],Yaoundé (Cameroon),,N$0ECBM00172,5W
82,Caribbean Community and Common Market  [CARICOM],Georgetown (Guyana),,N$0ECBM00180,6A3
83,Caribbean Development Bank [CDB],St Michael (Barbados),,N$0ECBM00198,5L
84,Central African States Development Bank [CASDB],Brazzaville,,N$0ECBM00206,5P
85,Central American Bank for Economic Integration [CABEI],Tegucigalpa,,N$0ECBM00214,5T
86,Central American Common Market  [CACM],Guatemala City,,N$0ECBM00222,6A4
87,Colombo Plan,Colombo,,N$0ECBM00230,5Z5
88,East African Development Bank [EADB],Kampala,,N$0ECBM00248,6A5
89,Eastern Caribbean Central Bank [ECCB],St.Kitts (West Indies),,N$0ECBM00255,5I
90,Economic Community of West African States  [ECOWAS],Abuja,,N$0ECBM00263,5Z6
91,ECOWAS Bank for Investment and Development [EBID],Lomé (Togo) ,,N$0ECBM00271,6A6
92,Eurasian Development Bank [EDB],Almaty (Kazakhstan),,N$0ECBM00289,7C
93,European Broadcasting Union [EBU],Geneva,,N$0ECBM00297,6K
94,European Company for the Financing of Railroad Rolling Stock  [EUROFIMA],Basel,,N$0ECBM00305,7M
95,European Free Trade Association  [EFTA],Geneva,,N$0ECBM00313,5Z7
96,European Organization for Nuclear Research  [CERN],Geneva,,N$0ECBM00321,6P
97,Foreign Trade Bank of Latin America [Bladex],Panama,,N$0ECBM00339,7I
98,Inter-American Development Bank [IADB],Washington,,N$0ECBM00347,5C
99,Inter-American Investment Corporation [IIC],Washington,,N$0ECBM00354,5G
100,International Bank for Economic Cooperation [IBEC],Moscow,,N$0ECBM00362,5J
101,International Bank for Reconstruction and Development (IBRD) [IBRD],Washington,EU20180000000000065776.2018-10-01.LEI.ZTMSNXROF84AHWJNKQ93,N$0ECBM00370,1E
102,International Centre for Settlement of Investment Disputes - WB Group [ICSID],Washington,,N$0ECBM00388,1G
103,International Civil Aviation Organization  [ICAO],Montreal,,N$0ECBM00396,5Z10
104,International Committee of the Red Cross  [ICRC],Geneva ,,N$0ECBM00404,6D
105,International Cotton Advisory Committee  [ICAC],Washington,,N$0ECBM00412,5Z14
106,International Development Association - WG Group [IDA],Washington,EU20180000000000065776.2018-10-01.LEI.P41R60HC414IWQA1XW02,N$0ECBM00420,1F
107,International Finance Corporation [IFC],Washington,EU20180000000000065776.2018-10-01.LEI.QKL54NQY28TCDAI75F60,N$0ECBM00438,1M
108,International Investment Bank [IIB],Moscow,,N$0ECBM00446,5K
109,International Jute Study Group  [IJSG],Dhaka,,N$0ECBM00453,5Z16
110,International Labour Organization  [ILO],Geneva,,N$0ECBM00461,1S
111,International Monetary Fund [IMF],Washington,,N$0ECBM00479,1C
112,International Organisation for Migration [IOM],Geneva,,N$0ECBM00487,6Q
113,International Telecommunication Union  [ITU],Geneva,,N$0ECBM00495,1T
114,Islamic Development Bank  [IDB],Jeddah,,N$0ECBM00503,7B
115,Latin American and the Caribbean Economic System  [SELA],Caracas,,N$0ECBM00511,5Z23
116,Latin American Association of Development Financing Institutions  [ALIDE],Lima,,N$0ECBM00529,6A7
117,Latin American Energy Organization  [OLADE],Quito,,N$0ECBM00537,5Z24
118,Latin American Integration Association  [LAIA],Montevideo,,N$0ECBM00545,5Z25
119,Latin American Reserve Fund [LARF],Bogotá,,N$0ECBM00552,7J
120,League of Arab States  [LAS],Cairo,,N$0ECBM00560,5Z26
121,Multilateral Investment Guarantee Agency - WB Group [MIGA],Washington,EU20180000000000065776.2018-10-01.LEI.549300ZG5PH6MA164968,N$0ECBM00578,1N
122,North American Development Bank  [NADB],San Antonio,,N$0ECBM00586,5Z44
123,Organisation of Eastern Caribbean States  [OECS],Castries (St Lucia),,N$0ECBM00594,5Z27
124,Organization of American States  [OAS],Washington,,N$0ECBM00602,5Z28
125,Organization of Arab Petroleum Exporting Countries  [OAPEC],Safat (Kuwait),,N$0ECBM00610,5Z29
126,Organization of Central American States  [OCAS],San Salvador,,N$0ECBM00628,5Z30
127,South Asian Association for Regional Cooperation  [SAARC],Kathmandu,,N$0ECBM00636,5Z33
128,Special Development Fund (related to the Caribbean Development Bank) [SDF],St Michael (Barbados),,N$0ECBM00644,5S
129,United Nations Children's Fund  [UNICEF],New York,,N$0ECBM00651,1O
130,United Nations Conference on Trade and Development  [UNCTAD],Geneva,,N$0ECBM00669,5Z34
131,"United Nations, its committees, funds and programmes, other [-]",New York,EU20180000000000065776.2018-11-09.LEI.549300HYGYJKXU2J8X74,N$0ECBM00677,1U
132,Universal Postal Union  [UPU],Berne,,N$0ECBM00685,1V
133,West African Central Bank [BCEAO],Dakar,,N$0ECBM00693,5O
134,West African Economic and Monetary Union [WAEMU],Ouagadougou,,N$0ECBM00701,7A
135,West African Economic Community  [WAEC],Ouagadougou,,N$0ECBM00719,5Z35
136,West African Health Organisation [WAHO],Bobo-Dioulasso (Burkina Faso),,N$0ECBM00727,5Z36
137,West African Monetary Agency  [WAMA],Freetown (Sierra Leone),,N$0ECBM00735,5Z37
138,West African Monetary Institute [WAMI],Accra (Gana),,N$0ECBM00743,5Z38
139,World Council of Churches  [WCC],Geneva,,N$0ECBM00750,5Z39
140,World Health Organization  [WHO],Geneva,,N$0ECBM00768,1K
141,World Intellectual Property Organization  [WIPO],Geneva,,N$0ECBM00776,5Z40
142,World Meteorological Organization  [WMO],Geneva,,N$0ECBM00784,5Z41
143,World Trade Organization  [WTO],Geneva,,N$0ECBM00792,1D
144,Black Sea Trade and Development Bank [BSTDB],Thessaloniki,,N$0ECBM00800,7G
145,Computer Emergency Response Team [CERT],Brussels,,N$0ECBM00818,4J84
146,Council of Europe  [CE],Strasbourg,The organisation is distinct from the 28-nation European Union (EU) it has 47 member states and founded by the Treaty of London 1949. ,N$0ECBM00826,6C
147,Council of Europe Development Bank [CEB],Paris,The 3rd Protocol to the general agreement on privileges and immunities of the Council of Europe.,N$0ECBM00834,7E
148,EU-Africa Infrastructure Trust Fund  [EU-ATIF],Luxembourg,,N$0ECBM00842,4R
149,European Bank for Reconstruction and Development [EBRD],London,,N$0ECBM00859,5F
150,European Centre for Medium-Range Weather Forecasts [ECMWF],Reading (UK),ECMWF Convention of 1975,N$0ECBM00867,6N
151,European Molecular Biology Laboratory [EMBL],Grenoble,"EMBL is an intergovernmental organisation, consisting of more than 20 member states, associate and prospect members.",N$0ECBM00875,6I
152,European Organisation for the Exploitation of Meteorological Satellites [EUMETSAT],Darmstadt (Germany),EUMETSAT is an intergovernmental organisation and was founded in 1986.,N$0ECBM00883,6L
153,European Organisation for the Safety of Air Navigation [EUROCONTROL],Brussels,EUROCONTROL is an international organisation founded in 1960 by the Eurocontrol Convention. Eurocontrol currently has 41 member states.,N$0ECBM00891,6G
154,European Patent Office [EPO],Muniche,EPO is an intergovernmental organisation that was set up on 7 October 1977 on the basis of the European Patent Convention (EPC) signed in Munich in 1973.,N$0ECBM00909,6F
155,European Southern Observatory [ESO],Muniche,ESO is a 16-nation intergovernmental research organization based on the ESO Declaration in 1954.,N$0ECBM00917,6M
156,European Space Agency  [ESA],Paris,ESA  was founded with the ESA Convention in 1975,N$0ECBM00925,6E
157,Facility for Euro-Mediterranean Investment and Partnership [FEMIP],Luxembourg,"FEMIP began in 2002, an important intensification of a more than 30-year financial partnership between the region and the EIB.",N$0ECBM00933,4V
158,Fonds Belgo-Congolais D’Amortissement et de Gestion [RDC],Brussels,,N$0ECBM00941,7K
159,Food and Agricultural Organization  [FAO],Rome,,N$0ECBM00958,1J
160,Fusion for Energy [F4E],Barcelona,,N$0ECBM00966,5Z8
161,Intergovernmental Council of Copper Exporting Countries  [CIPEC],Paris,,N$0ECBM00974,5Z9
162,International Atomic Energy Agency  [IAEA],Vienna,,N$0ECBM00982,1R
163,International Cocoa Organization  [ICCO],London,,N$0ECBM00990,5Z11
164,International Coffee Organization  [ICO],London,,N$0ECBM01006,5Z12
165,International Copper Study Group [ICSG],Lisbon,,N$0ECBM01014,5Z13
166,International Finance Facility for Immunisation [IFFIm],London,,N$0ECBM01022,7L
167,International Fund for Agricultural Development [IFAD],Rome,,N$0ECBM01030,1L
168,International Grains Council  [IGC],London,,N$0ECBM01048,5Z15
169,International Lead and Zinc Study Group  [ILZSG],Lisbon,,N$0ECBM01055,5Z17
170,International Maritime Organization  [IMO],London,,N$0ECBM01063,5Z18
171,International Maritime Satellite Organization  [INMARSAT],London,,N$0ECBM01071,5Z19
172,International Olive Oil Council  [IOOC],Madrid,,N$0ECBM01089,5Z20
173,International Rubber Study Group  [IRSG],London,,N$0ECBM01097,5Z21
174,International Sugar Organization  [ISO],London,,N$0ECBM01105,5Z22
175,International Union of Credit and Investment Insurers [Berne Union],London,,N$0ECBM01113,7F
176,Neighbourhood Investment Facility  [NIF],Rome,"Based on the Cotonou Agreement and the Overseas Association Decision, prior to their submission for the EIB Board of Directors’ approval.",N$0ECBM01121,4I
177,Nordic Investment Bank [NIB],Helsinki,,N$0ECBM01139,5H
178,North Atlantic Treaty Organisation  [NATO],Brussels,NATO an intergovernmental military alliance between several North American and European countries based on the North Atlantic Treaty of April 1949.,N$0ECBM01147,6B
179,OPEC Fund for International Development [OFID],Vienna,OFID is an intergovernmental development finance institution established in 1976 by the Member States of the Organization of the Petroleum Exporting Countries (OPEC).,N$0ECBM01154,6A8
180,Organisation for Economic Co-operation and Development  [OECD],Paris,The OECD Convention was signed in December 1960  as successor of the OEEC.,N$0ECBM01162,6O
181,Organization of the Petroleum Exporting Countries  [OPEC],Vienna,,N$0ECBM01170,5Z31
182,Paris Club Creditor Institutions  [Paris Club],Paris,,N$0ECBM01188,7D
183,"United Nations Educational, Scientific and Cultural Organization  [UNESCO]",Paris,,N$0ECBM01196,1H
184,World Tourism Organization [UNWTO],Madrid,,N$0ECBM01204,5Z42
185,The Permanent Court of Arbitration [PCA],The Hague,"Established by treaty in 1899, is an intergovernmental organization providing a variety of dispute resolution services to the international community",N$0ECBM01212,6A9
186,European Free Trade Association Court [EFTA COURT],Luxembourg,,N$ECBM02097,
187,NATO Support and Procurement Organisation [NSPO],Capellen,,N$ECBM02105,
188,The Eastern and Southern African Trade and Development Bank [TDB],Bujumbura,,N$ECBM846154,7O
189,International Council for the Exploration of the Sea [ICES],Koebenhavn V,,N$ECBM846162,
190,United Nations Relief and Works Agency for Palestine [UNRWA],Amman,,N$ECBM846170,1Q
191,Asian Infrastructure Investment Bank [AIIB],Beijing,,N$ECBM846204,5X
192,United Nations High Commissioner for Refugees [UNHCR],Geneva,,N$ECBM846394,1P
193,United Nations Economic Commission for Europe [UNECE],Geneva,,N$ECBM894782,1U1
194,International Telecommunications Satellite Organisation [ITSO],"Washington, D.C.",,N$ECBM894790,6J
195,"The Global Fund to Fight AIDS, Tuberculosis and Malaria [GLOBAL FUND]",Geneva,,N$ECBM922971,
196,United Nations Framework Convention for Climate Change [UNFCCC],Bonn,,N$ECBM922997,
197,International Energy Agency [IEA],Paris,,N$ECBM923003,
